{
  "schemaVersion": 1,
  "testFixture": true,
  "displayTimezone": "Asia/Tokyo",
  "post": {
    "id": "1000000000000000004",
    "url": "https://x.com/layout_test/status/1000000000000000004",
    "author": {
      "name": "测试作者🐉🌪️",
      "handle": "layout_test",
      "avatar": "assets/test-avatar.png",
      "verified": false,
      "verificationEvidence": null
    },
    "originalText": "これはテスト文章です。実在の投稿ではありません。",
    "translation": "【三图直播预告 · 测试】\n明天凌晨5点见！三张配图都保留完整画面与比例。",
    "publishedAt": "2026-10-29T20:29:00+09:00",
    "sourceTimezone": "Asia/Tokyo",
    "sourceScreenshot": {
      "file": "assets/test-source-not-real.png",
      "capturedAt": "2026-10-29T20:35:00+09:00",
      "reviewed": true
    },
    "sourceMediaCount": 3,
    "sourceQuote": "none",
    "media": [
      {
        "file": "assets/test-media-1.png",
        "completeness": "complete",
        "reviewed": true
      },
      {
        "file": "assets/test-media-2.png",
        "completeness": "complete",
        "reviewed": true
      },
      {
        "file": "assets/test-media-3.png",
        "completeness": "complete",
        "reviewed": true
      }
    ],
    "quote": null,
    "relationship": {
      "type": "original"
    },
    "metrics": {},
    "notes": [],
    "review": {
      "translationConfirmed": true,
      "sourceConfirmed": true
    }
  }
}
