{
  "schemaVersion": 1,
  "testFixture": true,
  "displayTimezone": "Asia/Tokyo",
  "post": {
    "id": "1000000000000000001",
    "url": "https://x.com/layout_test/status/1000000000000000001",
    "author": {
      "name": "测试作者🐉🌪️",
      "handle": "layout_test",
      "avatar": "assets/test-avatar.png",
      "verified": false,
      "verificationEvidence": null
    },
    "originalText": "これはテスト文章です。実在の投稿ではありません。",
    "translation": "今天让我休息一天吧🙇\n恢复体力，明天会直播！",
    "publishedAt": "2026-10-29T20:29:00+09:00",
    "sourceTimezone": "Asia/Tokyo",
    "sourceScreenshot": {
      "file": "assets/test-source-not-real.png",
      "capturedAt": "2026-10-29T20:35:00+09:00",
      "reviewed": true
    },
    "sourceMediaCount": 0,
    "sourceQuote": "none",
    "media": [],
    "quote": null,
    "relationship": {
      "type": "original"
    },
    "metrics": {},
    "notes": [],
    "review": {
      "translationConfirmed": true,
      "sourceConfirmed": true
    }
  }
}
