{
  "schemaVersion": 1,
  "testFixture": true,
  "displayTimezone": "Asia/Tokyo",
  "post": {
    "id": "1000000000000000003",
    "url": "https://x.com/layout_test/status/1000000000000000003",
    "author": {
      "name": "日本語と中文のテスト作者🐉",
      "handle": "very_long_account_abcdefghijabcdefghijabcdefghijabcdefghijabcdefghijabcdefghijabcdefghijabcdefghijabcdefghijabcdefghijabcdefghijabcdefghij",
      "avatar": "assets/test-avatar.png",
      "verified": false,
      "verificationEvidence": null
    },
    "originalText": "これはテスト文章です。実在の投稿ではありません。",
    "translation": "日本語のまま：配信は明日、朝5時から！\n中文：明天凌晨5点开播👩‍💻🐉🌪️🙇‍♂️🇯🇵🇨🇳 1️⃣\n原文中的“明天”保持原样。\nhttps://example.invalid/pathpathpathpathpathpathpathpathpathpathpathpathpathpathpathpathpathpathpathpathpathpathpathpathpathpathpathpathpathpathpathpathpathpathpathpathpathpathpathpathpathpathpathpathpathpathpathpathpathpathpathpathpathpathpathpathpathpathpathpathpathpathpathpathpath\n特殊字符：<script>alert(\"测试\")</script> & '单引号'。",
    "publishedAt": "2026-10-29T20:29:00+09:00",
    "sourceTimezone": "Asia/Tokyo",
    "sourceScreenshot": {
      "file": "assets/test-source-not-real.png",
      "capturedAt": "2026-10-29T20:35:00+09:00",
      "reviewed": true
    },
    "sourceMediaCount": 0,
    "sourceQuote": "none",
    "media": [],
    "quote": null,
    "relationship": {
      "type": "original"
    },
    "metrics": {},
    "notes": [
      "显示时区转换不改写正文中的相对时间。"
    ],
    "review": {
      "translationConfirmed": true,
      "sourceConfirmed": true
    }
  }
}
